{
  "session": {
    "questionsPerSession": 10,
    "timerSeconds": 10,
    "cooldownSeconds": 60
  },
  "limits": {
    "dailySessionsConnected": 10,
    "dailySessionsGuest": 5,
    "resetTimeET": "00:00"
  },
  "eligibility": {
    "connectedWindowMinutes": 60,
    "guestWindowMinutes": 25
  },
  "forging": {
    "categoryUltimateCount": 10,
    "masterUltimateCount": 10,
    "seasonalUltimateCount": 2,
    "seasonGraceDays": 7
  },
  "questions": {
    "reusedRatio": 0.5,
    "newRatio": 0.5,
    "poolThreshold": 1000
  },
  "season": {
    "pointsPerCorrect": 1,
    "perfectBonus": 10
  }
}
